     0  1  2  3  4  5  6  7  8  9  a  b  c  d  e  f    0123456789abcdef
00: b9 bd 9d 71 bf c8 00 cd a7 f8 a5 ac 8c 68 54 f8    ???q??.??????hT?
10: a5 f8 a5 ff 00 00 00 d4 46 41 24 50 4b 00 00 00    ???....?FA$PK...
20: 5e 5f d0 bb b8 b8 b8 1b 7e 92 94 62 59 62 59 d8    ^_??????~??bYbY?
30: c4 c3 b0 d9 b2 00 00 00 00 2d 28 a9 a9 a9 00 00    ?????....-(???..
40: 01 00 00 00 00 00 00 6e 00 22 01 40 00 00 80 06    ?......n."?@..??
50: ff ff 00 ff ff ff ff ff 31 8f 00 d5 ff 48 e2 1f    ........1?.?.H??
60: 5f 5f d0 bb b7 b7 b7 1b 7e 93 94 62 59 62 59 d8    __??????~??bYbY?
70: c4 c3 b0 d9 b2 00 00 00 00 2d 28 a9 a9 a9 00 00    ?????....-(???..
80: b9 bc 9d 71 bf c8 00 cd a7 f8 a5 ac 8c 68 54 f8    ???q??.??????hT?
90: a5 f8 a5 ff 00 00 00 d4 46 41 24 50 4b 00 00 00    ???....?FA$PK...
a0: 00 00 00 00 00 00 00 00 00 00 00 00 00 00 00 00    ................
b0: 00 00 00 00 00 00 00 00 00 00 00 00 00 00 00 00    ................
c0: ff ff ff ff ff ff ff ff ff ff ff ff ff ff ff ff    ................
d0: ff ff ff ff ff ff ff ff ff ff ff ff ff ff ff ff    ................
e0: 00 00 00 00 00 00 00 00 00 00 00 00 00 00 00 00    ................
f0: 00 00 00 00 00 00 00 00 00 00 00 00 00 00 00 00    ................

     0  1  2  3  4  5  6  7  8  9  a  b  c  d  e  f    0123456789abcdef
00: 80 00 00 00 ff ff ff ff ff ff ff ff ff ff ff ff    ?...............
10: ff ff ff ff ff ff ff ff ff ff ff ff ff ff ff ff    ................
20: ff ff ff ff ff ff ff ff ff ff ff ff ff ff ff ff    ................
30: ff ff ff ff ff ff ff ff ff ff ff ff ff ff ff ff    ................
40: ff ff ff ff ff ff ff ff ff ff ff ff ff ff 81 ff    ..............?.
50: 1c 80 00 32 00 3c 00 ff ff ff ff ff ff ff ff ff    ??.2.<..........
60: ff ff ff ff ff ff ff ff ff ff ff ff ff ff ff ff    ................
70: ff ff ff ff ff ff ff ff ff ff ff ff ff ff ff ff    ................
80: 1c 80 32 3c ff ff ff ff ff ff ff ff ff ff ff ff    ??2<............
90: ff ff ff ff ff ff ff ff ff ff ff ff ff ff ff ff    ................
a0: ff ff ff ff ff ff ff ff ff ff ff ff ff ff ff ff    ................
b0: ff ff ff ff ff ff ff ff ff ff ff ff ff ff ff ff    ................
c0: ff ff ff ff ff ff ff ff ff ff ff ff ff ff ff ff    ................
d0: ff ff ff ff ff ff ff ff ff ff ff ff ff ff ff ff    ................
e0: ff ff ff ff ff ff ff ff ff ff ff ff ff ff ff ff    ................
f0: ff ff ff ff ff ff ff ff ff ff ff ff ff ff ff ff    ................

     0  1  2  3  4  5  6  7  8  9  a  b  c  d  e  f    0123456789abcdef
00: 80 00 00 00 ff ff ff ff ff ff ff ff ff ff ff ff    ?...............
10: ff ff ff ff ff ff ff ff ff ff ff ff ff ff ff ff    ................
20: ff ff ff ff ff ff ff ff ff ff ff ff ff ff ff ff    ................
30: ff ff ff ff ff ff ff ff ff ff ff ff ff ff ff ff    ................
40: ff ff ff ff ff ff ff ff ff ff ff ff ff ff 82 ff    ..............?.
50: ff 80 00 28 00 2d 00 ff ff ff ff ff ff ff ff ff    .?.(.-..........
60: ff ff ff ff ff ff ff ff ff ff ff ff ff ff ff ff    ................
70: ff ff ff ff ff ff ff ff ff ff ff ff ff ff ff ff    ................
80: ff 80 28 2d ff ff ff ff ff ff ff ff ff ff ff ff    .?(-............
90: ff ff ff ff ff ff ff ff ff ff ff ff ff ff ff ff    ................
a0: ff ff ff ff ff ff ff ff ff ff ff ff ff ff ff ff    ................
b0: ff ff ff ff ff ff ff ff ff ff ff ff ff ff ff ff    ................
c0: ff ff ff ff ff ff ff ff ff ff ff ff ff ff ff ff    ................
d0: ff ff ff ff ff ff ff ff ff ff ff ff ff ff ff ff    ................
e0: ff ff ff ff ff ff ff ff ff ff ff ff ff ff ff ff    ................
f0: ff ff ff ff ff ff ff ff ff ff ff ff ff ff ff ff    ................

     0  1  2  3  4  5  6  7  8  9  a  b  c  d  e  f    0123456789abcdef
00: 00 00 ff ff 00 00 08 02 ff ff 00 ff 55 50 ff 00    ......??....UP..
10: 00 00 00 ff ff ff ff ff 11 01 ff ff 1f 9f 00 00    ........??..??..
20: 00 00 00 00 00 00 00 08 00 00 ff ff ff 00 ff ff    .......?........
30: 00 ff ff ff ff ff ff ff ff ff ff ff ff ff ff ff    ................
40: ff ff ff ff ff ff ff ff ff ff ff ff ff ff 83 ff    ..............?.
50: ff ff ff ff ff ff ff ff ff ff ff ff ff ff ff ff    ................
60: ff ff ff ff ff ff ff ff ff ff ff ff ff ff ff ff    ................
70: ff ff ff ff ff ff ff ff ff ff ff ff ff ff ff ff    ................
80: ff 1c 1c cf 00 00 00 ff ff ff ff ff ff ff ff ff    .???............
90: ff ff ff ff ff ff ff ff ff ff ff ff ff ff ff ff    ................
a0: ff ff ff ff ff ff ff ff ff ff ff ff ff ff ff ff    ................
b0: ff ff ff ff ff ff ff ff ff ff ff ff ff ff ff ff    ................
c0: ff ff ff ff ff ff ff ff ff ff ff ff ff ff ff ff    ................
d0: ff ff ff ff ff ff ff ff ff ff ff ff ff ff ff ff    ................
e0: 15 ff ff ff ff ff ff ff ff ff ff ff ff ff ff ff    ?...............
f0: 10 00 ff 00 00 00 ff ff ff ff ff ff ff ff ff ff    ?...............
