     0  1  2  3  4  5  6  7  8  9  a  b  c  d  e  f    0123456789abcdef
00: b9 c1 c9 c9 c9 cc 00 cd a7 f8 a5 ac 8c 68 54 f8    ??????.??????hT?
10: a5 f8 a5 ff 00 00 00 16 50 4b 25 50 4b 00 00 00    ???....?PK%PK...
20: 67 67 c9 bc cb cb cb 1a ff ff ff 77 4f 77 4f e3    gg??????...wOwO?
30: b9 cd a7 ed 9d 00 00 00 00 50 4b 80 00 00 00 00    ?????....PK?....
40: 01 00 00 00 00 00 00 5a 00 42 01 40 00 50 80 06    ?......Z.B?@.P??
50: ff ff 00 ff ff ff ff ff 31 89 00 d5 ff 21 e2 1f    ........1?.?.!??
60: 67 67 c9 bc ca ca ca 1a ff 71 ff 77 4f 77 4f e3    gg??????.q.wOwO?
70: b9 cd a7 ed 9d 00 00 00 00 50 4b 80 00 00 00 00    ?????....PK?....
80: b9 c0 ca c9 c9 cc 00 cd a7 f8 a5 ac 8c 68 54 f8    ??????.??????hT?
90: a5 f8 a5 ff 00 00 00 16 50 4b 25 50 4b 00 00 00    ???....?PK%PK...
a0: 00 00 00 00 00 00 00 00 00 00 00 00 00 00 00 00    ................
b0: 00 00 00 00 00 00 00 00 00 00 00 00 00 00 00 00    ................
c0: ff ff ff ff ff ff ff ff ff ff ff ff ff ff ff ff    ................
d0: ff ff ff ff ff ff ff ff ff ff ff ff ff ff ff ff    ................
e0: 00 00 00 00 00 00 00 00 00 00 00 00 00 00 00 00    ................
f0: 00 00 00 00 00 00 00 00 00 00 00 00 00 00 00 00    ................

     0  1  2  3  4  5  6  7  8  9  a  b  c  d  e  f    0123456789abcdef
00: 00 00 00 00 ff ff ff ff ff ff ff ff ff ff ff ff    ................
10: ff ff ff ff ff ff ff ff ff ff ff ff ff ff ff ff    ................
20: ff ff ff ff ff ff ff ff ff ff ff ff ff ff ff ff    ................
30: ff ff ff ff ff ff ff ff ff ff ff ff ff ff ff ff    ................
40: ff ff ff ff ff ff ff ff ff ff ff ff ff ff 81 ff    ..............?.
50: 26 80 00 46 00 50 00 ff ff ff ff ff ff ff ff ff    &?.F.P..........
60: ff ff ff ff ff ff ff ff ff ff ff ff ff ff ff ff    ................
70: ff ff ff ff ff ff ff ff ff ff ff ff ff ff ff ff    ................
80: 27 80 46 50 ff ff ff ff ff ff ff ff ff ff ff ff    '?FP............
90: ff ff ff ff ff ff ff ff ff ff ff ff ff ff ff ff    ................
a0: ff ff ff ff ff ff ff ff ff ff ff ff ff ff ff ff    ................
b0: ff ff ff ff ff ff ff ff ff ff ff ff ff ff ff ff    ................
c0: ff ff ff ff ff ff ff ff ff ff ff ff ff ff ff ff    ................
d0: ff ff ff ff ff ff ff ff ff ff ff ff ff ff ff ff    ................
e0: ff ff ff ff ff ff ff ff ff ff ff ff ff ff ff ff    ................
f0: ff ff ff ff ff ff ff ff ff ff ff ff ff ff ff ff    ................

     0  1  2  3  4  5  6  7  8  9  a  b  c  d  e  f    0123456789abcdef
00: 80 00 00 00 ff ff ff ff ff ff ff ff ff ff ff ff    ?...............
10: ff ff ff ff ff ff ff ff ff ff ff ff ff ff ff ff    ................
20: ff ff ff ff ff ff ff ff ff ff ff ff ff ff ff ff    ................
30: ff ff ff ff ff ff ff ff ff ff ff ff ff ff ff ff    ................
40: ff ff ff ff ff ff ff ff ff ff ff ff ff ff 82 ff    ..............?.
50: 0e 80 00 4b 00 50 00 ff ff ff ff ff ff ff ff ff    ??.K.P..........
60: ff ff ff ff ff ff ff ff ff ff ff ff ff ff ff ff    ................
70: ff ff ff ff ff ff ff ff ff ff ff ff ff ff ff ff    ................
80: 0f 00 4b 50 ff ff ff ff ff ff ff ff ff ff ff ff    ?.KP............
90: ff ff ff ff ff ff ff ff ff ff ff ff ff ff ff ff    ................
a0: ff ff ff ff ff ff ff ff ff ff ff ff ff ff ff ff    ................
b0: ff ff ff ff ff ff ff ff ff ff ff ff ff ff ff ff    ................
c0: ff ff ff ff ff ff ff ff ff ff ff ff ff ff ff ff    ................
d0: ff ff ff ff ff ff ff ff ff ff ff ff ff ff ff ff    ................
e0: ff ff ff ff ff ff ff ff ff ff ff ff ff ff ff ff    ................
f0: ff ff ff ff ff ff ff ff ff ff ff ff ff ff ff ff    ................

     0  1  2  3  4  5  6  7  8  9  a  b  c  d  e  f    0123456789abcdef
00: 00 00 ff ff c0 08 0c 02 ff ff 00 ff 55 50 ff 1c    ....????....UP.?
10: 1d 14 00 4b ff ff ff ff 11 00 ff ff 1f 9f 00 00    ??.K....?...??..
20: 00 00 00 00 00 00 00 0f 00 cf ff ff ff 00 ff ff    .......?.?......
30: 00 ff ff ff ff ff ff ff ff ff ff ff ff ff ff ff    ................
40: ff ff ff ff ff ff ff ff ff ff ff ff ff ff 83 ff    ..............?.
50: ff ff ff ff ff ff ff ff ff ff ff ff ff ff ff ff    ................
60: ff ff ff ff ff ff ff ff ff ff ff ff ff ff ff ff    ................
70: ff ff ff ff ff ff ff ff ff ff ff ff ff ff ff ff    ................
80: ff 7c 1c fd 00 01 00 ff ff ff ff ff ff ff ff ff    .|??.?..........
90: ff ff ff ff ff ff ff ff ff ff ff ff ff ff ff ff    ................
a0: ff ff ff ff ff ff ff ff ff ff ff ff ff ff ff ff    ................
b0: ff ff ff ff ff ff ff ff ff ff ff ff ff ff ff ff    ................
c0: ff ff ff ff ff ff ff ff ff ff ff ff ff ff ff ff    ................
d0: ff ff ff ff ff ff ff ff ff ff ff ff ff ff ff ff    ................
e0: 14 ff ff ff ff ff ff ff ff ff ff ff ff ff ff ff    ?...............
f0: 13 00 ff 00 00 00 ff ff ff ff ff ff ff ff ff ff    ?...............
