[root@localhost ~]# i2cdump 11 0x2e
     0  1  2  3  4  5  6  7  8  9  a  b  c  d  e  f    0123456789abcdef
00: 31 43 ff ff ff ff ff ff 00 01 00 ff 5c 50 c5 51    1C.......?..\P?Q
10: ff ff ff ff ff ff ff ff 00 00 ff ff ff ff ff ff    ................
20: 40 d5 03 00 fb 00 0f 0f 0f ff 02 0a 00 02 00 00    @??.?.???.??.?..
30: 00 00 00 a0 00 00 68 2a ef 50 00 44 00 db 09 73    ...?..h*?P.D.??s
40: 29 07 00 00 00 00 00 00 00 00 00 00 44 03 00 00    )?..........D?..
50: 73 01 00 00 32 03 00 00 38 03 00 00 46 00 46 00    s?..2?..8?..F.F.
60: 46 01 23 02 00 00 00 00 00 00 ff ff ff ff ff ff    F?#?............
70: ff ff ff ff ff ff ff ff ff ff 50 c5 51 ff ff ff    ..........P?Q...
80: ff 1f ff 1f ff 1f ff 1f ff 1f ff 1f ff 1f ff 1f    .?.?.?.?.?.?.?.?
90: ff 1f ff 1f 00 00 00 00 ff ff ff ff ff ff ff ff    .?.?............
a0: 2c 00 00 00 00 00 00 00 00 00 00 00 00 00 00 00    ,...............
b0: 00 00 00 00 ff ff ff ff 00 00 00 00 00 00 00 00    ................
c0: 10 ff ff 1d 00 ff 03 00 00 00 40 ff ff 1f 01 ff    ?..?..?...@..??.
d0: 0f 0f 0f 0f 4f ff 00 00 00 00 00 00 00 00 00 00    ????O...........
e0: 00 00 00 00 00 00 ff ff 60 7f 00 00 00 0f 00 00    ........`?...?..
f0: 00 00 00 00 00 00 00 00 00 00 00 00 00 00 ff 00    ................
[root@localhost ~]# i2cset -y 11 0x2e 0xff 1
[root@localhost ~]# i2cdump -y 11 0x2e
     0  1  2  3  4  5  6  7  8  9  a  b  c  d  e  f    0123456789abcdef
00: ff 07 00 00 ff 07 00 00 ff 07 00 00 ff 07 00 00    .?...?...?...?..
10: ff 07 00 00 ff 07 00 00 ff 07 00 00 ff 07 00 00    .?...?...?...?..
20: ff 07 00 00 ff 07 00 00 ff 07 00 00 ff 07 00 00    .?...?...?...?..
30: ff 07 00 00 ff 07 00 00 ff 07 00 00 ff 07 00 00    .?...?...?...?..
40: ff 07 00 00 64 5f 55 50 ff ff ff ff ff ff ff ff    .?..d_UP........
50: ff ff ff ff ff ff ff ff ff ff ff ff ff ff ff ff    ................
60: ff 1f ff 1f ff 1e ff 1e ff 1e ff 1e ff 1e ff 1e    .?.?.?.?.?.?.?.?
70: ff 1e ff 1e ff 1e ff 1e ff ff 50 c5 51 ff ff ff    .?.?.?.?..P?Q...
80: ff 07 00 00 ff 07 00 00 ff 07 00 00 ff ff ff ff    .?...?...?......
90: 64 5f 55 50 64 5f 55 50 64 5f 55 50 64 5f 55 50    d_UPd_UPd_UPd_UP
a0: 64 5f 55 50 64 5f 55 50 64 5f 55 50 64 5f 55 50    d_UPd_UPd_UPd_UP
b0: 78 73 64 5f 78 73 64 5f 78 73 64 5f 78 73 64 5f    xsd_xsd_xsd_xsd_
c0: ff ff ff ff ff ff ff ff ff ff ff ff ff ff ff ff    ................
d0: 4f 00 00 00 00 ff ff ff 00 00 00 00 00 00 00 ff    O...............
e0: 00 00 00 00 ff ff ff ff 01 ff ff ff ff ff ff ff    ........?.......
f0: ff ff ff ff 40 01 00 ff 00 00 00 00 00 ff 02 01    ....@?........??
[root@localhost ~]# i2cset -y 11 0x2e 0xff 2
[root@localhost ~]# i2cdump -y 11 0x2e
     0  1  2  3  4  5  6  7  8  9  a  b  c  d  e  f    0123456789abcdef
00: 18 01 00 40 01 00 01 01 00 00 00 00 03 ff 12 62    ??.@?.??....?.?b
10: 00 00 00 00 00 00 00 00 00 00 00 00 00 00 00 00    ................
20: 00 00 00 00 00 00 00 00 00 ff ff ff ff ff ff ff    ................
30: f8 80 f8 80 f8 80 f8 80 f8 80 f8 80 f8 80 f8 80    ????????????????
40: 00 a0 00 00 00 00 00 00 00 00 00 ff 00 00 00 00    .?..............
50: 90 01 08 00 00 00 00 00 ff ff ff ff ff ff ff ff    ???.............
60: 20 00 00 00 08 00 00 00 00 ff 00 ff 00 00 00 00     ...?...........
70: 00 00 00 00 ff ff ff ff ff ff 50 c5 51 ff ff ff    ..........P?Q...
80: 03 10 ff ff 00 00 00 00 00 00 00 00 00 00 00 00    ??..............
90: 00 00 00 00 00 00 00 00 00 00 00 00 f3 f3 f3 f3    ............????
a0: ff ff ff ff ff ff ff ff ff ff ff ff ff ff ff ff    ................
b0: ff ff ff ff ff ff ff ff ff ff ff ff ff ff ff ff    ................
c0: ff 07 ff ff 00 00 00 00 00 00 00 00 00 00 00 ff    .?..............
d0: 00 00 00 07 00 00 00 07 00 00 00 07 00 00 00 07    ...?...?...?...?
e0: 00 00 00 07 00 00 00 07 00 00 00 07 00 00 00 07    ...?...?...?...?
f0: ff ff ff ff ff ff ff ff ff ff ff ff ff ff ff 02    ...............?
[root@localhost ~]# i2cset -y 11 0x2e 0xff 3
[root@localhost ~]# i2cdump -y 11 0x2e
     0  1  2  3  4  5  6  7  8  9  a  b  c  d  e  f    0123456789abcdef
00: 01 02 00 00 7f 0a 0a 00 02 04 05 00 00 00 00 00    ??..???.???.....
10: 8e 2c 7f 7f 08 08 84 84 00 ff ff 10 00 ff ff ff    ?,??????...?....
20: 47 3c 5a 5a 53 53 53 53 00 00 00 00 14 14 14 14    G<ZZSSSS....????
30: 19 1e 28 32 2f 6f af ff 26 2b 30 35 00 20 40 60    ??(2/o?.&+05. @`
40: 19 23 2d 37 8c aa c8 e6 19 23 2d 37 8c aa c8 e6    ?#-7?????#-7????
50: 00 80 00 ff ff ff ff ff 8e 2c 8c 8c 00 00 00 00    .?......?,??....
60: ff ff ff ff 00 00 00 00 00 00 00 00 ff ff ff ff    ................
70: 00 00 00 00 ff ff ff ff ff ff 50 c5 51 ff ff ff    ..........P?Q...
80: 00 00 00 00 00 00 00 00 ff ff ff ff ff ff ff ff    ................
90: 00 00 80 00 00 07 ff ff ff ff ff ff ff ff ff ff    ..?..?..........
a0: 00 ff ff ff ff ff ff ff ff ff ff ff ff ff ff ff    ................
b0: ff ff ff ff ff ff ff ff ff ff ff ff ff ff ff ff    ................
c0: ff ff ff ff ff ff ff ff ff ff ff ff ff ff ff ff    ................
d0: ff ff ff ff ff ff ff ff ff ff ff ff ff ff ff ff    ................
e0: ff ff ff ff ff ff ff ff ff ff ff ff ff ff ff ff    ................
f0: ff ff ff ff ff ff ff ff ff ff ff ff ff ff ff 03    ...............?
[root@localhost ~]# i2cset -y 11 0x2e 0xff 4
[root@localhost ~]# i2cdump -y 11 0x2e
     0  1  2  3  4  5  6  7  8  9  a  b  c  d  e  f    0123456789abcdef
00: 00 00 00 00 00 00 ff ff 00 00 00 00 00 00 ff ff    ................
10: 5a 5a 5a 5a 5a 5a ff ff ff ff ff ff ff ff ff ff    ZZZZZZ..........
20: 53 53 53 53 53 53 ff ff ff ff ff ff ff ff ff ff    SSSSSS..........
30: 19 23 2d 37 8c aa c8 e6 19 23 2d 37 8c aa c8 e6    ?#-7?????#-7????
40: 19 23 2d 37 8c aa c8 e6 19 23 2d 37 8c aa c8 e6    ?#-7?????#-7????
50: 19 23 2d 37 8c aa c8 e6 19 23 2d 37 8c aa c8 e6    ?#-7?????#-7????
60: ff ff ff ff 8c 8c 8c 8c 8c 8c ff ff ff ff ff ff    ....??????......
70: ff ff ff ff ff ff ff ff ff ff 50 c5 51 ff ff ff    ..........P?Q...
80: ff ff ff ff ff ff ff ff 3c 50 3c 50 3c 50 3c 50    ........<P<P<P<P
90: 3c 50 3c 50 3c 50 3c 50 33 33 33 33 33 33 33 33    <P<P<P<P33333333
a0: 00 00 00 00 00 00 ff ff 00 00 00 00 00 00 00 00    ................
b0: 8e 2c 7f 7f 00 00 00 00 00 00 00 00 ff ff ff ff    ?,??............
c0: ff ff ff ff ff ff ff ff ff ff ff ff ff ff ff ff    ................
d0: ff ff ff ff ff ff ff ff ff ff ff ff ff ff ff ff    ................
e0: ff ff ff ff ff ff ff ff ff ff ff ff ff ff ff ff    ................
f0: ff ff ff ff ff ff ff ff ff ff ff ff ff ff ff 04    ...............?
[root@localhost ~]# i2cset -y 11 0x2e 0xff 5
[root@localhost ~]# i2cdump -y 11 0x2e
     0  1  2  3  4  5  6  7  8  9  a  b  c  d  e  f    0123456789abcdef
00: ff ff ff ff ff ff ff ff ff ff ff ff ff ff ff ff    ................
10: ff ff ff ff ff ff ff ff ff ff ff ff ff ff ff ff    ................
20: ff ff ff ff ff ff ff ff ff ff ff ff ff ff ff ff    ................
30: ff ff ff ff ff ff ff ff ff ff ff ff ff ff ff ff    ................
40: ff ff ff ff ff ff ff ff ff ff ff ff ff ff ff ff    ................
50: ff ff ff ff ff ff ff ff ff ff ff ff ff ff ff ff    ................
60: ff ff ff ff ff ff ff ff ff ff ff ff ff ff ff ff    ................
70: ff ff ff ff ff ff ff ff ff ff 50 c5 51 ff ff ff    ..........P?Q...
80: ff ff ff ff ff ff ff ff ff ff ff ff ff ff ff ff    ................
90: ff ff ff ff ff ff ff ff ff ff ff ff ff ff ff ff    ................
a0: ff ff ff ff ff ff ff ff ff ff ff ff ff ff ff ff    ................
b0: ff ff ff ff ff ff ff ff ff ff ff ff ff ff ff ff    ................
c0: ff ff ff ff ff ff ff ff ff ff ff ff ff ff ff ff    ................
d0: ff ff ff ff ff ff ff ff ff ff ff ff ff ff ff ff    ................
e0: ff ff ff ff ff ff ff ff ff ff ff ff ff ff ff ff    ................
f0: ff ff ff ff ff ff ff ff ff ff ff ff ff ff ff 05    ...............?
