Montage Technology M88SPD5118

Corsair

0  1  2  3  4  5  6  7  8  9  a  b  c  d  e  f    0123456789abcdef
00: 51 18 0a 86 32 03 32 00 00 00 00 00 ff 7f 00 00    Q???2?2......?..
10: 00 00 00 00 00 00 00 00 00 00 00 00 70 03 00 00    ............p?..
20: 50 05 00 00 00 00 00 00 00 00 00 00 00 00 00 00    P?..............
30: 00 54 02 00 00 00 00 00 00 00 00 00 00 00 00 00    .T?.............
40: 00 00 00 00 00 00 00 00 00 00 00 00 00 00 00 00    ................
50: 00 00 00 00 00 00 00 00 00 00 00 00 00 00 00 00    ................
60: 00 00 00 00 00 00 00 00 00 00 00 00 00 00 00 00    ................
70: 00 00 00 00 00 00 00 00 00 00 00 00 00 00 00 00    ................
80: 30 10 12 02 04 00 20 62 00 00 00 00 60 00 00 00    0????. b....`...
90: 00 00 00 00 a0 01 f2 03 72 0d 00 00 00 00 1a 41    ....????r?....?A
a0: 1a 41 1a 41 00 7d 1a be 30 75 27 01 a0 00 82 00    ?A?A.}??0u'??.?.
b0: 00 00 00 00 00 00 00 00 00 00 00 00 00 00 00 00    ................
c0: 00 00 00 00 00 00 88 13 08 88 13 08 20 4e 20 10    ......?????? N ?
d0: 27 10 15 34 20 10 27 10 c4 09 04 4c 1d 0c 00 00    '??4 ?'????L??..
e0: 00 00 00 00 00 00 00 00 00 00 00 00 00 00 00 00    ................
f0: 00 00 00 00 00 00 00 00 00 00 00 00 00 00 00 00    ................

Kingston KF556S40-32

     0  1  2  3  4  5  6  7  8  9  a  b  c  d  e  f    0123456789abcdef
00: 51 18 0a 86 32 03 32 00 00 00 00 07 ff 3c 00 00    Q???2?2....?.<..
10: 00 00 00 00 00 00 00 00 00 00 00 00 70 03 00 00    ............p?..
20: 50 05 00 00 00 00 00 00 00 00 00 00 00 00 00 00    P?..............
30: 00 f0 01 00 00 00 00 00 00 00 00 00 00 00 00 00    .??.............
40: 00 00 00 00 00 00 00 00 00 00 00 00 00 00 00 00    ................
50: 00 00 00 00 00 00 00 00 00 00 00 00 00 00 00 00    ................
60: 00 00 00 00 00 00 00 00 00 00 00 00 00 00 00 00    ................
70: 00 00 00 00 00 00 00 00 00 00 00 00 00 00 00 00    ................
80: 00 00 00 00 00 00 00 00 00 00 00 00 00 00 00 00    ................
90: 00 00 00 00 00 00 00 00 00 00 00 00 00 00 00 00    ................
a0: 00 00 00 00 00 00 00 00 00 00 00 00 00 00 00 00    ................
b0: 00 00 00 00 00 00 00 00 00 00 00 00 00 00 00 00    ................
c0: 00 00 00 00 00 00 00 00 00 00 00 00 00 00 00 00    ................
d0: 00 00 00 00 00 00 00 00 00 00 00 00 00 00 00 00    ................
e0: 00 00 00 00 00 00 00 00 00 00 00 00 00 00 00 00    ................
f0: 00 00 00 00 00 00 00 00 00 00 00 00 00 00 00 00    ................

Kingston Fury KF552C40BBK2-16

      0  1  2  3  4  5  6  7  8  9  a  b  c  d  e  f 0123456789abcdef
00: 51 18 0a 86 32 03 32 00 00 00 00 00 ff 3c 00 00 Q???2?2......<..
10: 00 00 00 00 00 00 00 00 00 00 00 00 70 03 00 00 ............p?..
20: 50 05 00 00 00 00 00 00 00 00 00 00 00 00 00 00 P?..............
30: 00 c0 01 00 00 00 00 00 00 00 00 00 00 00 00 00 .??.............
40: 00 00 00 00 00 00 00 00 00 00 00 00 00 00 00 00 ................
50: 00 00 00 00 00 00 00 00 00 00 00 00 00 00 00 00 ................
60: 00 00 00 00 00 00 00 00 00 00 00 00 00 00 00 00 ................
70: 00 00 00 00 00 00 00 00 00 00 00 00 00 00 00 00 ................
80: 30 10 12 02 04 00 40 42 00 00 00 00 b2 12 0d 00 0????.@B....???.
90: 00 00 00 00 a0 01 f2 03 7a 0d 00 00 00 00 80 3e ....????z?....?>
a0: 80 3e 80 3e 00 7d 80 bb 30 75 27 01 a0 00 82 00 ?>?>.}??0u'??.?.
b0: 00 00 00 00 00 00 d4 00 00 00 d4 00 00 00 d4 00 ......?...?...?.
c0: 00 00 d4 00 00 00 88 13 08 88 13 08 20 4e 20 10 ..?...?????? N ?
d0: 27 10 1a 41 28 10 27 10 c4 09 04 4c 1d 0c 00 00 '??A(?'????L??..
e0: 00 00 00 00 00 00 00 00 00 00 00 00 00 00 00 00 ................
f0: 00 00 00 00 00 00 00 00 00 00 00 00 00 00 00 00 ................

IDT/Renesas controller

page 0:

     0  1  2  3  4  5  6  7  8  9  a  b  c  d  e  f    0123456789abcdef
00: 51 18 12 80 b3 03 52 00 00 00 00 00 ff 03 00 55    Q?????R......?.U
10: 00 00 00 00 00 00 00 00 00 00 00 00 70 03 00 00    ............p?..
20: 50 05 00 00 00 00 00 00 00 00 00 00 00 00 00 00    P?..............
30: 00 a4 01 00 00 00 00 00 00 00 00 00 00 00 00 00    .??.............
40: 00 00 00 00 00 00 00 00 00 00 f0 00 00 00 00 00    ..........?.....
50: 00 00 00 00 00 00 00 00 00 00 00 00 00 00 00 00    ................
60: 00 00 00 00 00 00 00 00 00 00 00 00 00 00 00 00    ................
70: 00 00 00 00 00 00 00 00 00 00 00 00 00 00 00 00    ................
80: 30 11 12 03 04 00 20 62 00 00 00 00 a2 12 0f 00    0????. b....???.
90: 00 00 00 00 65 01 f2 03 7a ad 00 00 00 00 80 3e    ....e???z?....?>
a0: 80 3e 80 3e 00 7d 80 bb 30 75 27 01 a0 00 82 00    ?>?>.}??0u'??.?.
b0: 00 00 00 00 00 00 d4 01 00 00 d4 01 00 00 d4 01    ......??..??..??
c0: 00 00 d4 01 00 00 88 13 08 88 13 08 20 4e 20 10    ..??..?????? N ?
d0: 27 10 a4 2c 20 10 27 10 c4 09 04 4c 1d 0c 00 00    '??, ?'????L??..
e0: 00 00 00 00 00 00 00 00 00 00 00 00 00 00 00 00    ................
f0: 00 00 00 00 00 00 00 00 00 00 00 00 00 00 00 00    ................

page 1:

     0  1  2  3  4  5  6  7  8  9  a  b  c  d  e  f    0123456789abcdef
00: 00 00 00 00 00 00 00 00 00 00 00 01 00 00 00 00    ...........?....
10: 00 00 00 00 00 00 00 00 00 00 00 00 00 00 00 00    ................
20: 00 00 00 00 00 00 00 00 00 00 00 00 00 00 00 00    ................
30: 00 00 00 00 00 00 00 00 00 00 00 00 00 00 00 00    ................
40: 00 00 00 00 00 00 00 00 00 00 00 00 00 00 00 00    ................
50: 00 00 00 00 00 00 00 00 00 00 00 00 00 00 00 00    ................
60: 00 00 00 00 00 00 00 00 00 00 00 00 00 00 00 00    ................
70: 00 00 00 00 00 00 00 00 00 00 00 00 00 00 00 00    ................
80: 00 00 00 00 00 00 00 00 00 00 00 00 00 00 00 00    ................
90: 00 00 00 00 00 00 00 00 00 00 00 00 00 00 00 00    ................
a0: 00 00 00 00 00 00 00 00 00 00 00 00 00 00 00 00    ................
b0: 00 00 00 00 00 00 00 00 00 00 00 00 00 00 00 00    ................
c0: 10 00 80 b3 80 21 0b 2a 82 03 00 00 00 00 00 00    ?.???!?*??......
d0: 00 00 00 00 00 00 00 00 00 00 00 00 00 00 00 00    ................
e0: 00 00 00 00 00 00 0f 11 04 82 08 2a 00 00 00 00    ......?????*....
f0: 00 00 00 00 00 00 00 00 00 00 00 00 00 00 00 00    ................

page 7:

     0  1  2  3  4  5  6  7  8  9  a  b  c  d  e  f    0123456789abcdef
00: 00 00 00 00 00 00 00 00 00 00 00 07 00 00 00 00    ...........?....
10: 00 00 00 00 00 00 00 00 00 00 00 00 00 00 00 00    ................
20: 00 00 00 00 00 00 00 00 00 00 00 00 00 00 00 00    ................
30: 00 00 00 00 00 00 00 00 00 00 00 00 00 00 00 00    ................
40: 00 00 00 00 00 00 00 00 00 00 00 00 00 00 00 00    ................
50: 00 00 00 00 00 00 00 00 00 00 00 00 00 00 00 00    ................
60: 00 00 00 00 00 00 00 00 00 00 00 00 00 00 00 00    ................
70: 00 00 00 00 00 00 00 00 00 00 00 00 00 00 00 00    ................
80: 00 00 00 00 00 00 00 00 00 00 00 00 00 00 00 00    ................
90: 00 00 00 00 00 00 00 00 00 00 00 00 00 00 00 00    ................
a0: 00 00 00 00 00 00 00 00 00 00 00 00 00 00 00 00    ................
b0: 00 00 00 00 00 00 00 00 00 00 00 00 00 00 00 00    ................
c0: 00 00 00 00 00 00 00 00 00 00 00 00 00 00 00 00    ................
d0: 00 00 00 00 00 00 00 00 00 00 00 00 00 00 00 00    ................
e0: 00 00 00 00 00 00 00 00 00 00 00 00 00 00 00 00    ................
f0: 00 00 00 00 00 00 00 00 00 00 00 00 00 00 00 00    ................
