# isadump 0xa15 0xa16 0

     0  1  2  3  4  5  6  7  8  9  a  b  c  d  e  f
00: 04 ff 88 ff 01 00 00 00 01 80 01 01 3c 3c 04 04 
10: 04 00 10 00 00 01 01 3c 53 07 00 00 ff ff ff ca 
20: 6b 5d 99 95 d0 60 05 1d ff 80 ff b8 4d 62 59 9e 
30: 8f 99 8b d9 c4 62 59 fe 47 2d 2b ff a8 e9 e5 ff 
40: 03 4e 15 ff ff ff 07 b5 2d 00 00 c4 10 95 00 a3 
50: ff ff 00 ff ff ff 00 80 c1 7f ff ff 19 21 00 05 
60: 04 00 40 00 01 01 3c ff 01 ff 01 ff ff ff ff ff 
70: ff ff ff ff ff ff ff ff ff ff ff ff ff ff ff ff 
80: 04 ff 88 ff 01 00 00 00 01 80 01 01 3c 3c 04 04 
90: 04 00 10 00 00 01 01 3c 53 07 00 00 ff ff ff ca 
a0: 6b 5d 99 95 d0 60 05 1d ff 80 ff b8 4d 62 59 9e 
b0: 8f 99 8b d9 c4 62 59 fe 47 2d 2b ff a8 e9 e5 ff 
c0: 03 00 10 ff ff ff 07 b5 2d 00 00 c4 10 95 00 a3 
d0: ff ff 00 ff ff ff 00 80 c1 7f ff ff 19 21 00 05 
e0: 04 00 40 00 01 01 3c ff 01 ff 01 ff ff ff ff ff 
f0: ff ff ff ff ff ff ff ff ff ff ff ff ff ff ff ff 


# isadump 0xa15 0xa16 1

     0  1  2  3  4  5  6  7  8  9  a  b  c  d  e  f
00: 04 ff 88 ff 01 00 00 00 01 80 01 01 3c 3c 04 04 
10: 04 00 10 00 00 01 01 3c 53 07 00 00 ff ff ff d6 
20: 6b 5d 99 95 d0 60 05 1d ff 7f ff b8 4d 62 59 9e 
30: 8f 99 8b d9 c4 62 59 fe 47 2d 2b ff a8 e9 e5 ff 
40: 03 00 10 ff ff ff 07 b5 2d 00 00 c4 10 95 01 a3 
50: 1f 80 02 39 00 3c 00 00 ff ff ff ff ff ff ff ff 
60: 04 00 40 00 01 01 3c ff 01 ff 01 ff ff ff ff ff 
70: ff ff ff ff ff ff ff ff ff ff ff ff ff ff ff ff 
80: 04 ff 88 ff 01 00 00 00 01 80 01 01 3c 3c 04 04 
90: 04 00 10 00 00 01 01 3c 53 07 00 00 ff ff ff d6 
a0: 6b 5d 99 95 d0 60 05 1d ff 7f ff b8 4d 62 59 9e 
b0: 8f 99 8b d9 c4 62 59 fe 47 2d 2b ff a8 e9 e5 ff 
c0: 03 00 10 ff ff ff 07 b5 2d 00 00 c4 10 95 01 a3 
d0: 1f 80 02 39 00 3c 00 00 ff ff ff ff ff ff ff ff 
e0: 04 00 40 00 01 01 3c ff 01 ff 01 ff ff ff ff ff 
f0: ff ff ff ff ff ff ff ff ff ff ff ff ff ff ff ff 


# isadump 0xa15 0xa16 2

     0  1  2  3  4  5  6  7  8  9  a  b  c  d  e  f
00: 04 ff 88 ff 01 00 00 00 01 80 01 01 3c 3c 04 04 
10: 04 00 10 00 00 01 01 3c 53 07 00 00 ff ff ff c0 
20: 6b 5d 99 95 d0 60 05 1d ff 80 ff b8 4d 62 59 9e 
30: 8f 99 8b d9 c4 62 59 fe 47 2d 2b ff a8 e9 e5 ff 
40: 03 00 10 ff ff ff 07 b5 2d 00 00 c4 10 95 02 a3 
50: 1d 00 02 75 00 7f 1e 40 ff ff ff ff ff ff ff ff 
60: 04 00 40 00 01 01 3c ff 01 ff 01 ff ff ff ff ff 
70: ff ff ff ff ff ff ff ff ff ff ff ff ff ff ff ff 
80: 04 ff 88 ff 01 00 00 00 01 80 01 01 3c 3c 04 04 
90: 04 00 10 00 00 01 01 3c 53 07 00 00 ff ff ff c0 
a0: 6b 5d 99 95 d0 60 05 1d ff 80 ff b8 4d 62 59 9e 
b0: 8f 99 8b d9 c4 62 59 fe 47 2d 2b ff a8 e9 e5 ff 
c0: 03 00 10 ff ff ff 07 b5 2d 00 00 c4 10 95 02 a3 
d0: 1d 00 02 75 00 7f 1e 40 ff ff ff ff ff ff ff ff 
e0: 04 00 40 00 01 01 3c ff 01 ff 01 ff ff ff ff ff 
f0: ff ff ff ff ff ff ff ff ff ff ff ff ff ff ff ff 
