# i2cdump 0 0x2f b 0 0

     0  1  2  3  4  5  6  7  8  9  a  b  c  d  e  f    0123456789abcdef
00: 80 55 ff 78 3f a0 ff 00 0f 00 0f ff 00 00 00 00    ?U.x??..?.?.....
10: 7d 34 bf be 00 cc c7 7e 00 00 00 89 88 86 83 c1    }4??.??~...?????
20: c1 80 80 96 98 23 16 00 00 00 00 00 00 00 0f ff    ?????#?.......?.
30: ff ff 12 ff ff ff 00 00 00 00 00 00 00 ff ff ff    ..?.............
40: 90 f2 00 30 00 ee 00 00 00 40 00 ff 00 7f 3f ff    ??.0.?...@...??.
50: 00 00 00 00 00 00 ff ff 81 00 03 00 00 00 00 00    ........?.?.....
60: 00 00 00 00 00 00 00 00 00 00 00 64 64 ff ff ff    ...........dd...
70: af 57 af 57 ce a8 ce 89 ce 89 af 32 af 32 72 46    ?W?W???????2?2rF
80: ff 00 ff 00 ff 00 96 7d 96 7d 96 7d 96 4f 50 ba    ......?}?}?}?OP?
90: 29 2a 3f 00 00 00 64 5f 55 50 64 5f 55 50 64 5f    )*?...d_UPd_UPd_
a0: 55 50 64 5f 55 50 5a 57 55 52 5a 57 55 52 5a 57    UPd_UPZWURZWURZW
b0: 55 52 54 4f 55 50 ff ff d2 d2 d2 d2 d2 d2 ff ff    URTOUP..??????..
c0: ff ff ff ff ee ff ff ff ee ee ee ff ff ff ff ff    ....?...???.....
d0: 00 00 00 00 00 00 00 00 00 22 24 0a 60 00 00 00    ........."$?`...
e0: 00 00 00 00 00 00 bb c0 09 09 09 09 09 22 22 02    ......???????""?
f0: ff 00 00 00 00 00 00 00 00 0f ff 51 af 5c 79 50    .........?.Q?\yP


# i2cdump 0 0x2f b 1 0

     0  1  2  3  4  5  6  7  8  9  a  b  c  d  e  f    0123456789abcdef
00: 81 ff ff ff ff ff ff ff ff ff ff ff ff ff ff ff    ?...............
10: ff ff ff ff ff ff ff ff ff ff ff ff ff ff ff ff    ................
20: c1 08 10 50 79 5a 00 24 00 00 00 00 a0 8e 54 4b    ???PyZ.$....??TK
30: 3f 6a 13 ec ff ff ff ff ff ff ff ff ff ff ff 00    ?j??............
40: 03 03 07 07 07 07 07 07 07 07 07 07 07 07 07 07    ????????????????
50: 07 03 07 07 07 07 07 07 07 07 07 07 07 07 07 07    ????????????????
60: 07 07 07 07 07 07 07 07 07 03 03 03 03 03 03 03    ????????????????
70: 03 07 23 ff ff ff ff ff ff ff ff ff ff ff ff ff    ??#.............
80: 01 02 04 05 06 07 08 09 0a 0b 0c 0d 0e 0f 10 11    ????????????????
90: 12 03 01 02 03 21 43 65 87 a9 cb ed 21 43 65 21    ?????!Ce????!Ce!
a0: 43 65 87 17 ff ff ff ff ff ff ff ff ff ff ff ff    Ce??............
b0: 00 11 12 10 ff ff ff ff ff ff ff ff ff ff ff ff    .???............
c0: ff ff ff ff ff ff ff ff ff ff ff ff ff ff ff ff    ................
d0: ff ff ff ff ff ff ff ff ff ff ff ff ff ff ff ff    ................
e0: ff ff ff ff ff ff ff ff ff ff ff ff ff ff ff ff    ................
f0: ff 00 00 00 00 00 00 00 00 0f ff 51 af 5c 79 50    .........?.Q?\yP


# i2cdump 0 0x2f b 2 0

     0  1  2  3  4  5  6  7  8  9  a  b  c  d  e  f    0123456789abcdef
00: 82 00 03 03 00 00 00 00 3f 11 11 00 40 01 01 02    ?.??....???.@???
10: 4c 4c 4d 4d 4d 4d 4d 4d 84 85 85 85 85 85 85 85    LLMMMMMM????????
20: 30 30 30 30 30 30 30 30 10 10 10 10 10 10 10 10    00000000????????
30: 00 00 00 00 00 00 00 00 ff ff ff ff ff ff ff ff    ................
40: 60 00 60 00 60 00 60 00 60 00 60 00 60 00 60 00    `.`.`.`.`.`.`.`.
50: 10 ff ff ff ff ff ff ff ff ff ff ff ff ff ff ff    ?...............
60: 28 28 28 28 28 28 ff ff 4c 4c 60 60 60 60 ff ff    ((((((..LL````..
70: 00 00 00 00 00 00 ff ff ff ff ff ff ff ff ff ff    ................
80: 1b 1b 1b 1b 1b 2f 4b ff 4c 4c 4c 4c 4c 80 ff ff    ?????/K.LLLLL?..
90: 1b 1b 1b 1b 1b 2f 4b ff 4c 4c 4c 4c 4c 80 ff ff    ?????/K.LLLLL?..
a0: 00 00 00 00 00 00 00 ff ff ff ff ff ff ff ff ff    ................
b0: 00 00 00 00 00 00 00 ff ff ff ff ff ff ff ff ff    ................
c0: 1b 1b 1b 1b 1b 2f 4b ff 4c 4c 4c 4c 4c 80 ff ff    ?????/K.LLLLL?..
d0: 1b 1b 1b 1b 1b 2f 4b ff 4c 4c 4c 4c 4c 80 ff ff    ?????/K.LLLLL?..
e0: 00 00 80 80 80 80 80 80 80 80 ff ff ff ff ff ff    ..????????......
f0: ff 00 00 00 00 00 00 00 00 0f ff 51 af 5c 79 50    .........?.Q?\yP


# i2cdump 0 0x2f b 3 0

     0  1  2  3  4  5  6  7  8  9  a  b  c  d  e  f    0123456789abcdef
00: 83 00 03 ff ff ff ff ff ff ff ff ff ff ff ff ff    ?.?.............
10: 25 00 22 81 ff 03 ff 00 00 01 00 40 00 00 ff ff    %."?.?...?.@....
20: 55 55 50 50 50 50 50 50 ff ff ff ff ff ff ff ff    UUPPPPPP........
30: 00 00 00 00 00 00 20 00 01 00 01 ff ff ff ff ff    ...... .?.?.....
40: f0 6c 80 00 f8 80 f8 80 f8 80 f8 80 f8 80 f8 80    ?l?.????????????
50: f8 80 f8 80 f8 80 f8 80 f8 80 f8 80 f8 80 f8 80    ????????????????
60: f9 00 f9 00 f9 00 f9 00 f9 00 f9 00 f9 00 f9 00    ?.?.?.?.?.?.?.?.
70: 00 00 00 00 00 00 00 00 00 00 00 00 ff ff ff ff    ................
80: 00 00 00 00 00 40 ff ff f9 00 00 ff ff ff ff ff    .....@..?.......
90: 02 17 00 0a 00 00 00 ef 42 90 ef ff ff ff ff ff    ??.?...?B??.....
a0: 10 19 00 00 01 01 00 00 00 00 cf 00 ff ff ff ff    ??..??....?.....
b0: ff ff ff ff ff ff ff ff ff ff ff ff ff ff ff ff    ................
c0: ff ff ff ff ff ff ff ff ff ff ff ff ff ff ff ff    ................
d0: ff ff ff ff ff ff ff ff ff ff ff ff ff ff ff ff    ................
e0: ff ff ff ff ff ff ff ff ff ff ff ff ff ff ff ff    ................
f0: ff 00 00 00 00 00 00 00 00 0f ff 51 af 5c 79 50    .........?.Q?\yP
